{
  "workflow": "sdd",
  "specName": "Demo — Planned",
  "branch": "demo/planned",
  "selectedAt": "2026-05-20T20:00:00.000Z",
  "currentStep": "plan",
  "status": "planned",
  "stepHistory": {
    "specify": {
      "startedAt": "2026-05-20T20:00:00.000Z",
      "completedAt": "2026-05-20T20:05:00.000Z"
    },
    "plan": {
      "startedAt": "2026-05-20T20:05:00.000Z",
      "completedAt": "2026-05-20T20:10:00.000Z"
    }
  },
  "transitions": []
}
