{
  "workflow": "sdd",
  "specName": "Demo — Specified",
  "branch": "demo/specified",
  "selectedAt": "2026-05-20T20:00:00.000Z",
  "currentStep": "specify",
  "status": "specified",
  "stepHistory": {
    "specify": {
      "startedAt": "2026-05-20T20:00:00.000Z",
      "completedAt": "2026-05-20T20:05:00.000Z"
    }
  },
  "transitions": []
}
